{
  "name": "research-papers",
  "version": "0.1.0",
  "copy_to": "_meta/domain-packs/research-papers/",
  "recommended_workflow": [
    "wiki-ingest",
    "llm-wiki-provenance",
    "llm-wiki-claim-anchors",
    "wiki-query",
    "llm-wiki-eval"
  ],
  "templates": [
    {
      "source": "templates/wiki/source-page.md",
      "target": "wiki/sources/paper-template.md"
    },
    {
      "source": "templates/wiki/concept-page.md",
      "target": "wiki/concepts/method-template.md"
    }
  ],
  "initial_prompts": [
    "Use wiki-ingest on one paper and create a draft source page with extracted claims and limitations.",
    "Use llm-wiki-provenance to identify which claims need paper-section support."
  ]
}
